{
  "content_id": "9b2e22e1-a222-4cda-9799-de7ce56088b0",
  "base_path": "/guidance/content-design",
  "title": "Content design: planning, writing and managing content",
  "description": "Planning and managing digital content to meet the needs the public has of government.",
  "format": "manual",
  "need_ids": [],
  "locale": "en",
  "public_updated_at": "2015-04-27T12:54:27.000+00:00",
  "publishing_app": "specialist-publisher",
  "rendering_app": "manuals-frontend",
  "update_type": "major",
  "details": {
    "body": "\n",
    "child_section_groups": [
      {
        "title": "Contents",
        "child_sections": [
          {
            "title": "What is content design?",
            "description": "Introduction to content design.",
            "base_path": "/guidance/content-design/what-is-content-design"
          },
          {
            "title": "User needs",
            "description": "How to write and record a user need for GOV.UK.",
            "base_path": "/guidance/content-design/user-needs"
          },
          {
            "title": "Planning content",
            "description": "Find out how to decide if something is suitable for GOV.UK, what the content lifecycle is and why accessibility must be planned for.",
            "base_path": "/guidance/content-design/planning-content"
          }
        ]
      }
    ],
    "change_notes": [
      {
        "base_path": "/guidance/content-design/what-is-content-design",
        "title": "What is content design?",
        "change_note": "New section added.",
        "published_at": "2014-10-06T19:49:25Z"
      },
      {
        "base_path": "/guidance/content-design/user-needs",
        "title": "User needs",
        "change_note": "New section added.",
        "published_at": "2014-10-06T19:49:25Z"
      },
      {
        "base_path": "/guidance/content-design/planning-content",
        "title": "Planning content",
        "change_note": "New section added.",
        "published_at": "2014-10-06T19:49:25Z"
      },
      {
        "base_path": "/guidance/content-design/content-types",
        "title": "Content types",
        "change_note": "New section added.",
        "published_at": "2014-10-06T19:49:25Z"
      }
    ],
    "organisations": [
      {
        "title": "Government Digital Service",
        "abbreviation": "GDS",
        "web_url": "https://www.gov.uk/government/organisations/government-digital-service"
      }
    ]
  },
  "routes": [
    {
      "path": "/guidance/content-design",
      "type": "exact"
    }
  ]
}
